[
  {
    "toolId": "130a8372-bc43-5e15-9c29-4cbfb9209ae3",
    "name": "getGithubRepo",
    "description": "Fetches public metadata for a GitHub repository (no authentication needed; subject to GitHub's 60 requests/hour anonymous rate limit).\n\nReturns: { fullName, description, stars, forks, openIssues, language, license, defaultBranch, lastPush, topics, homepage, htmlUrl }.",
    "staticVariables": [],
    "params": [
      {
        "name": "owner",
        "description": "GitHub user or org login (e.g. 'spring-projects')",
        "required": true,
        "type": "STRING",
        "testValue": "spring-projects"
      },
      {
        "name": "repo",
        "description": "Repository name (e.g. 'spring-ai')",
        "required": true,
        "type": "STRING",
        "testValue": "spring-ai"
      }
    ],
    "code": "/**\n * Fetches public metadata for a GitHub repository.\n *\n * No authentication needed; GitHub allows 60 requests per hour from\n * an anonymous client (rate-limit headers are returned in the response).\n *\n * On 404, returns { found: false, owner, repo } instead of throwing.\n */\n\nconst url = 'https://api.github.com/repos/'\n  + encodeURIComponent(owner) + '/' + encodeURIComponent(repo);\n\nconst resp = await fetch(url, {\n  headers: {\n    'Accept': 'application/vnd.github+json',\n    'User-Agent': 'spring-ai-playground',\n  },\n  maxLength: 1_000_000,\n});\n\nif (resp.status === 404) return { found: false, owner, repo };\nif (!resp.ok) return { success: false, status: resp.status, message: resp.text() };\n\nconst data = resp.json();\nreturn {\n  fullName:      data.full_name,\n  description:   data.description,\n  stars:         data.stargazers_count,\n  forks:         data.forks_count,\n  openIssues:    data.open_issues_count,\n  language:      data.language,\n  license:       data.license && data.license.spdx_id,\n  defaultBranch: data.default_branch,\n  lastPush:      data.pushed_at,\n  topics:        data.topics || [],\n  homepage:      data.homepage,\n  htmlUrl:       data.html_url,\n};\n",
    "codeType": "Javascript",
    "createTimestamp": 1768000000000,
    "updateTimestamp": 1768000000000,
    "category": "WEB",
    "tags": [
      "github"
    ],
    "sandboxOverrides": {
      "addAllowClasses": [],
      "removeAllowClasses": [],
      "addDenyClasses": [],
      "removeDenyClasses": [],
      "networkMode": "allowlist",
      "hostsAllow": [
        "api.github.com"
      ],
      "fileRead": null,
      "fileWrite": null,
      "fsBasePath": null
    },
    "toolSafety": {
      "version": "1.0",
      "runtime": {
        "id": "spring-ai-playground/polyglot-js",
        "minVersion": "0.2.0",
        "ecmaVersion": "2024",
        "javaInterop": false,
        "helpers": [
          "safety.http/v1"
        ],
        "console": true
      },
      "category": {
        "source": "builtin",
        "id": "WEB"
      },
      "capabilities": {
        "network": {
          "mode": "allowlist",
          "hosts": []
        },
        "fileRead": false,
        "fileWrite": false
      }
    },
    "draft": true
  },
  {
    "toolId": "52ff12b1-bc45-5827-b076-352516cf53a9",
    "name": "searchWikipedia",
    "description": "Looks up a Wikipedia page summary by title. No authentication required. Uses the public REST API at en.wikipedia.org/api/rest_v1/page/summary.\n\nReturns: { title, description, extract (plain-text summary), thumbnail, pageUrl }. If the title is not found, returns { found: false, title }.",
    "staticVariables": [],
    "params": [
      {
        "name": "title",
        "description": "Article title (case-insensitive, spaces ok)",
        "required": true,
        "type": "STRING",
        "testValue": "Spring Framework"
      },
      {
        "name": "lang",
        "description": "Language code (e.g. 'en', 'ko', default 'en')",
        "required": false,
        "type": "STRING",
        "testValue": "en"
      }
    ],
    "code": "/**\n * Looks up a Wikipedia article summary by title.\n *\n * Uses the public REST API:  https://{lang}.wikipedia.org/api/rest_v1/page/summary/{title}\n * No auth, generous rate limits, JSON response.\n *\n * `lang` is the wiki subdomain — 'en', 'ko', 'ja', etc. Defaults to 'en'.\n */\n\nif (title == null || title === '') throw new Error('title required');\nconst language = (lang && lang !== '') ? lang : 'en';\n\nconst url = 'https://' + language + '.wikipedia.org/api/rest_v1/page/summary/'\n  + encodeURIComponent(String(title).replace(/ /g, '_'));\n\nconst resp = await fetch(url, {\n  headers: { 'Accept': 'application/json', 'User-Agent': 'spring-ai-playground' },\n  maxLength: 1_000_000,\n});\n\nif (resp.status === 404) return { found: false, title };\nif (!resp.ok) return { success: false, status: resp.status, message: resp.text() };\n\nconst data = resp.json();\nreturn {\n  title:       data.title,\n  description: data.description,\n  extract:     data.extract,\n  thumbnail:   data.thumbnail && data.thumbnail.source,\n  pageUrl:     data.content_urls && data.content_urls.desktop && data.content_urls.desktop.page,\n};\n",
    "codeType": "Javascript",
    "createTimestamp": 1768000000000,
    "updateTimestamp": 1768000000000,
    "category": "WEB",
    "tags": [
      "search"
    ],
    "sandboxOverrides": {
      "addAllowClasses": [],
      "removeAllowClasses": [],
      "addDenyClasses": [],
      "removeDenyClasses": [],
      "networkMode": "allowlist",
      "hostsAllow": [
        "en.wikipedia.org",
        "ko.wikipedia.org",
        "ja.wikipedia.org",
        "es.wikipedia.org",
        "de.wikipedia.org",
        "fr.wikipedia.org",
        "zh.wikipedia.org"
      ],
      "fileRead": null,
      "fileWrite": null,
      "fsBasePath": null
    },
    "toolSafety": {
      "version": "1.0",
      "runtime": {
        "id": "spring-ai-playground/polyglot-js",
        "minVersion": "0.2.0",
        "ecmaVersion": "2024",
        "javaInterop": false,
        "helpers": [
          "safety.http/v1"
        ],
        "console": true
      },
      "category": {
        "source": "builtin",
        "id": "WEB"
      },
      "capabilities": {
        "network": {
          "mode": "allowlist",
          "hosts": []
        },
        "fileRead": false,
        "fileWrite": false
      }
    }
  },
  {
    "toolId": "5b16e1fd-e917-58dc-a64d-f82ca521a631",
    "name": "searchHackerNews",
    "description": "Searches Hacker News stories via the public Algolia HN Search API (no auth needed).\n\nReturns up to `hits` results, each as: { id, title, url, points, author, commentCount, createdAt, hnLink }.",
    "staticVariables": [],
    "params": [
      {
        "name": "query",
        "description": "Search query string",
        "required": true,
        "type": "STRING",
        "testValue": "spring ai"
      },
      {
        "name": "hits",
        "description": "Max results to return (1-20, default 5)",
        "required": false,
        "type": "INTEGER",
        "testValue": "5"
      },
      {
        "name": "tag",
        "description": "HN tag filter: story | comment | poll | etc (optional)",
        "required": false,
        "type": "STRING",
        "testValue": "story"
      }
    ],
    "code": "/**\n * Searches Hacker News via the Algolia HN Search API.\n *\n * Endpoint:  https://hn.algolia.com/api/v1/search?query=...&hitsPerPage=...&tags=...\n *\n * Available tags: story, comment, poll, pollopt, show_hn, ask_hn, front_page.\n * No authentication, public rate limit.\n */\n\nif (query == null || query === '') throw new Error('query required');\nconst n = (Number.isInteger(hits) && hits > 0 && hits <= 20) ? hits : 5;\n\nconst params = new URLSearchParams();\nparams.set('query', String(query));\nparams.set('hitsPerPage', String(n));\nif (tag && tag !== '') params.set('tags', String(tag));\n\nconst resp = await fetch('https://hn.algolia.com/api/v1/search?' + params.toString(), {\n  maxLength: 2_000_000,\n});\nif (!resp.ok) return { success: false, status: resp.status, message: resp.text() };\n\nconst data = resp.json();\nreturn (data.hits || []).map(h => ({\n  id:           h.objectID,\n  title:        h.title || h.story_title,\n  url:          h.url || h.story_url,\n  points:       h.points,\n  author:       h.author,\n  commentCount: h.num_comments,\n  createdAt:    h.created_at,\n  hnLink:       'https://news.ycombinator.com/item?id=' + h.objectID,\n}));\n",
    "codeType": "Javascript",
    "createTimestamp": 1768000000000,
    "updateTimestamp": 1768000000000,
    "category": "WEB",
    "tags": [
      "search"
    ],
    "sandboxOverrides": {
      "addAllowClasses": [],
      "removeAllowClasses": [],
      "addDenyClasses": [],
      "removeDenyClasses": [],
      "networkMode": "allowlist",
      "hostsAllow": [
        "hn.algolia.com"
      ],
      "fileRead": null,
      "fileWrite": null,
      "fsBasePath": null
    },
    "toolSafety": {
      "version": "1.0",
      "runtime": {
        "id": "spring-ai-playground/polyglot-js",
        "minVersion": "0.2.0",
        "ecmaVersion": "2024",
        "javaInterop": false,
        "helpers": [
          "safety.http/v1"
        ],
        "console": true
      },
      "category": {
        "source": "builtin",
        "id": "WEB"
      },
      "capabilities": {
        "network": {
          "mode": "allowlist",
          "hosts": []
        },
        "fileRead": false,
        "fileWrite": false
      }
    },
    "draft": true
  },
  {
    "toolId": "cd0ad7d7-0937-5bca-9296-7cf8a091278a",
    "name": "searchStackOverflow",
    "description": "Searches Stack Overflow questions via the public Stack Exchange API (anonymous, capped at 300 requests / IP / day).\n\nReturns up to `pageSize` results sorted by `sort` (relevance | activity | votes | creation), each as: { id, title, score, answerCount, isAnswered, tags, link, createdAt, owner }.",
    "staticVariables": [],
    "params": [
      {
        "name": "query",